{
  "$schema": "http://json-schema.org/draft-07/schema#",
  "$id": "https://example.local/schemas/fuzz_replay_report.schema.json",
  "title": "Fuzz Replay Report",
  "type": "object",
  "required": [
    "schema_version",
    "generated_at_utc",
    "seed",
    "cases",
    "meta"
  ],
  "additionalProperties": false,
  "properties": {
    "schema_version": {
      "type": "string"
    },
    "generated_at_utc": {
      "type": "string"
    },
    "seed": {
      "type": "string"
    },
    "cases": {
      "type": "array",
      "items": {
        "type": "object",
        "required": [
          "case_id",
          "out_dir",
          "result",
          "reason_codes"
        ],
        "additionalProperties": false,
        "properties": {
          "case_id": {
            "type": "string"
          },
          "out_dir": {
            "type": "string"
          },
          "result": {
            "type": "string"
          },
          "reason_codes": {
            "type": "array",
            "items": {
              "type": "string"
            }
          }
        }
      }
    },
    "meta": {
      "$ref": "#/definitions/meta"
    }
  },
  "definitions": {
    "artifact_ref": {
      "type": "object",
      "additionalProperties": false,
      "required": [
        "path",
        "version"
      ],
      "properties": {
        "path": {
          "type": "string",
          "minLength": 1
        },
        "version": {
          "type": "string",
          "minLength": 1
        },
        "id": {
          "type": "string",
          "minLength": 1
        },
        "sha256": {
          "type": "string",
          "minLength": 1
        }
      }
    },
    "guard_spec": {
      "type": "object",
      "additionalProperties": false,
      "required": [
        "guard_id",
        "deny_decision",
        "deny_reason_code",
        "evidence_kinds"
      ],
      "properties": {
        "guard_id": {
          "type": "string",
          "minLength": 1
        },
        "guard_kind": {
          "type": "string",
          "enum": [
            "stop",
            "structural",
            "repairable",
            "advisory"
          ]
        },
        "predicate_ref": {
          "type": "string",
          "minLength": 1
        },
        "deny_decision": {
          "type": "string",
          "enum": [
            "DENY",
            "STOP"
          ]
        },
        "deny_reason_code": {
          "type": "string",
          "pattern": "^[A-Z0-9_]+$"
        },
        "evidence_kinds": {
          "type": "array",
          "items": {
            "type": "string"
          },
          "default": []
        }
      }
    },
    "guard_eval": {
      "type": "object",
      "additionalProperties": false,
      "required": [
        "guard_id",
        "status"
      ],
      "properties": {
        "guard_id": {
          "type": "string",
          "minLength": 1
        },
        "status": {
          "type": "string",
          "enum": [
            "PASS",
            "FAIL",
            "SKIP"
          ]
        },
        "decision": {
          "type": "string",
          "enum": [
            "ALLOW",
            "DENY",
            "STOP"
          ]
        },
        "reason_codes": {
          "type": "array",
          "items": {
            "type": "string"
          },
          "default": []
        },
        "evidence_refs": {
          "type": "array",
          "items": {
            "type": "string"
          },
          "default": []
        },
        "notes": {
          "type": "string"
        }
      }
    },
    "meta": {
      "type": "object",
      "additionalProperties": false,
      "required": [
        "policy_linkage",
        "requirements",
        "guards"
      ],
      "properties": {
        "policy_linkage": {
          "type": "object",
          "additionalProperties": false,
          "required": [
            "reason_codes_ref"
          ],
          "properties": {
            "reason_codes_ref": {
              "$ref": "#/definitions/artifact_ref"
            },
            "plant_spec_ref": {
              "$ref": "#/definitions/artifact_ref"
            },
            "guardrails_bundle_ref": {
              "$ref": "#/definitions/artifact_ref"
            },
            "control_strategy_ref": {
              "$ref": "#/definitions/artifact_ref"
            },
            "rank_policy_ref": {
              "$ref": "#/definitions/artifact_ref"
            },
            "pattern_catalog_ref": {
              "$ref": "#/definitions/artifact_ref"
            },
            "src_conventions_ref": {
              "$ref": "#/definitions/artifact_ref"
            }
          }
        },
        "requirements": {
          "type": "object",
          "additionalProperties": false,
          "required": [
            "required_evidence"
          ],
          "properties": {
            "required_evidence": {
              "type": "array",
              "items": {
                "type": "string"
              },
              "default": []
            }
          }
        },
        "guards": {
          "type": "object",
          "additionalProperties": false,
          "required": [
            "spec",
            "eval"
          ],
          "properties": {
            "spec": {
              "type": "array",
              "items": {
                "$ref": "#/definitions/guard_spec"
              },
              "default": []
            },
            "eval": {
              "type": "array",
              "items": {
                "$ref": "#/definitions/guard_eval"
              },
              "default": []
            }
          }
        }
      }
    }
  }
}
