{
  "schema_version": "0.1",
  "generated_at_utc": "2026-02-10T00:00:00Z",
  "seed": "seed-0001",
  "meta": {
    "policy_linkage": {
      "reason_codes_ref": {
        "path": "control/ssot/reason_codes.json",
        "version": "0.1"
      }
    },
    "requirements": {
      "required_evidence": []
    },
    "guards": {
      "spec": [],
      "eval": []
    }
  },
  "cases": [
    {
      "case_id": "C1",
      "out_dir": "out/fuzz/C1",
      "result": "PASS",
      "reason_codes": []
    }
  ]
}
